{
  "$id": "https://new-game.local/schema/trait.schema.json",
  "$schema": "https://json-schema.org/draft/2020-12/schema",
  "title": "Trait",
  "type": "object",
  "additionalProperties": false,
  "required": ["id", "label", "description", "tags", "effects"],
  "properties": {
    "id": { "$ref": "https://new-game.local/schema/game-data.schema.json#/$defs/id" },
    "label": { "type": "string", "minLength": 1 },
    "description": { "type": "string", "minLength": 1 },
    "tags": {
      "type": "array",
      "items": { "$ref": "https://new-game.local/schema/game-data.schema.json#/$defs/id" },
      "uniqueItems": true
    },
    "effects": {
      "type": "array",
      "items": { "$ref": "https://new-game.local/schema/effect.schema.json" }
    }
  }
}
